Boston University Clinical and Translational Science Institute,NCATS,9084912,1KL2TR001411-01,1,KL2,TR,1411,1,,,1877725,"FELSON, DAVID TOBIN",Not Applicable,BOSTON UNIVERSITY MEDICAL CAMPUS, ,2015,467195,
Colon afferents: molecular identity; histology/morphology and hypersensitivity,NIDDK,8764385,1K01DK100460-01A1,1,K01,DK,100460,1,A1,,11457878,"FENG, BIN ",Not Applicable,UNIVERSITY OF PITTSBURGH AT PITTSBURGH, ,2014,111198,
Macrophage-mediated Immunosurveillance in Cancer,NCI,9011699,1K99CA201075-01,1,K99,CA,201075,1,,,12161561,"FENG, MINGYE ",Not Applicable,STANFORD UNIVERSITY, ,2015,173448,
Dissecting the role of miR-9 in normal and malignant mast cell biology,OD,8805547,1K01OD019923-01,1,K01,OD,19923,1,,,12112668,"FENGER, JOELLE M",Not Applicable,OHIO STATE UNIVERSITY, ,2015,130869,
Optimizing a Pediatric Intervention to Increase Maternal Depression Care-Seeking,NIMH,8700234,1K23MH101157-01A1,1,K23,MH,101157,1,A1,,9398438,"FERNANDEZ Y GARCIA, ERIK ORLANDO",Not Applicable,UNIVERSITY OF CALIFORNIA AT DAVIS, ,2014,180550,
Mentoring in the Context of Improving Care for Latinos with Diabetes,NIDDK,8689828,1K24DK102057-01,1,K24,DK,102057,1,,,7128881,"FERNANDEZ, ALICIA ",Not Applicable,"UNIVERSITY OF CALIFORNIA, SAN FRANCISCO", ,2014,183864,
Age-dependent microglial responses in hypoxia-ischemia,NINDS,8581613,1K08NS078113-01A1,1,K08,NS,78113,1,A1,,9742090,"FERRAZZANO, PETER A",Not Applicable,UNIVERSITY OF WISCONSIN-MADISON, ,2013,192005,
Child Health Career Development Program at UCSF,NICHD,8500073,1K12HD072222-01A1,1,K12,HD,72222,1,A1,,6109673,"FERRIERO, DONNA M.",Not Applicable,"UNIVERSITY OF CALIFORNIA, SAN FRANCISCO", ,2013,432000,
Metabolic Reprogramming in Pulmonary Arterial Hypertension,NHLBI,8765519,1K08HL121174-01A1,1,K08,HL,121174,1,A1,,10664733,"FESSEL, JOSHUA PATRICK",Not Applicable,VANDERBILT UNIVERSITY, ,2014,125410,
Characterization of Salmonella typhimurium-induced NET formation,OD,8567353,1K01OD017239-01,1,K01,OD,17239,1,,,11533532,"FIGUEIREDO, JOSELY F",Not Applicable,UNIVERSITY OF WISCONSIN-MADISON, ,2013,108011,
Structural Aspects of Oligomerization in the Function of GPCRs,NIDA,8635658,2K02DA026434-06,2,K02,DA,26434,6,,,6762349,"FILIZOLA, MARTA ",Not Applicable,ICAHN SCHOOL OF MEDICINE AT MOUNT SINAI, ,2014,124416,
Sleep disturbance as a putative mechanism for reward system dysfunction,NIDA,8700073,1K23DA035915-01A1,1,K23,DA,35915,1,A1,,11099819,"FINAN, PATRICK ",Not Applicable,JOHNS HOPKINS UNIVERSITY, ,2014,167607,
Neurobiological Mechanisms of Sympathetic Regulation in Sleep Apnea,NINR,8634208,1K99NR014369-01A1,1,K99,NR,14369,1,A1,,8722427,"FINK, ANNE M",Not Applicable,UNIVERSITY OF ILLINOIS AT CHICAGO, ,2013,99295,
Role of Ire1alpha in Resistance to Viral-Induced Apoptosis,NIAID,8949883,1K08AI119142-01,1,K08,AI,119142,1,,,11376494,"FINK, SUSAN L.",Not Applicable,YALE UNIVERSITY, ,2015,179874,
Mentored Career Development for Child and Family Centered Outcomes Research,AHRQ,8702311,1K12HS022986-01,1,K12,HS,22986,1,,,1911916,"FINKELSTEIN, JONATHAN A",Not Applicable,BOSTON CHILDREN'S HOSPITAL, ,2014,862380,
Molecular pathogenesis of alpha-tocopherol associated neuroaxonal dystrophy in an,OD,8508391,1K01OD015134-01A1,1,K01,OD,15134,1,A1,,10748212,"FINNO, CARRIE ",Not Applicable,UNIVERSITY OF MINNESOTA, ,2013,101354,
Cancer and Stem Cell Dynamics in the Intestine,NCI,8765556,1K99CA181679-01A1,1,K99,CA,181679,1,A1,,8866989,"FISCHER, JARED MICHAEL",Not Applicable,OREGON HEALTH & SCIENCE UNIVERSITY, ,2014,101772,
The evolutionary and molecular mechanisms underlying sperm performance in an emer,NICHD,8442021,1K99HD071972-01A1,1,K99,HD,71972,1,A1,,8875706,"FISHER, HEIDI S",Not Applicable,HARVARD UNIVERSITY, ,2013,129708,
Opiate drug abuse & HIV-induced excitotoxicity in striatal neurons,NIDA,8410974,1K99DA033878-01A1,1,K99,DA,33878,1,A1,,10885481,"FITTING, SYLVIA ",Not Applicable,VIRGINIA COMMONWEALTH UNIVERSITY, ,2013,110190,
Peripheral & Brain Cholesterol Metabolism in Neurodegenerative Mouse Models,NIA,8700653,1K01AG044490-01A1,1,K01,AG,44490,1,A1,,9577565,"FITZ, NICHOLAS FRANCIS",Not Applicable,UNIVERSITY OF PITTSBURGH AT PITTSBURGH, ,2014,92587,
Mechanistic Distinctions in Female Chronic Pelvic Pain Subtypes,NICHD,8442724,1K23HD069511-01A1,1,K23,HD,69511,1,A1,,10495498,"FITZGERALD, COLLEEN MARIE",Not Applicable,LOYOLA UNIVERSITY CHICAGO, ,2013,124155,
Developing an Implementation Program to Optimize Uptake of HIV Pre-Exposure Prophylaxis among Black Women in Primary Care Settings,NIMH,9063893,1K23MH109358-01,1,K23,MH,109358,1,,,11182698,"FLASH, CHARLENE A",Not Applicable,BAYLOR COLLEGE OF MEDICINE, ,2015,170807,
Air Pollution Exposure during Pregnancy; Maternal Glycemia; and Offspring Growth,NIEHS,8805031,1K23ES024803-01,1,K23,ES,24803,1,,,11008907,"FLEISCH, ABBY ",Not Applicable,BOSTON CHILDREN'S HOSPITAL, ,2015,166724,
Gene expression outcomes in interventions for substance using HIV+ minority men,NIDA,8993533,1K23DA039800-01A1,1,K23,DA,39800,1,A1,,11075079,"FLENTJE, ANNESA ",Not Applicable,"UNIVERSITY OF CALIFORNIA, SAN FRANCISCO", ,2015,194820,
Age-related changes in the neural stem cells of the olfactory epithelium,NIA,8700120,1K01AG045344-01A1,1,K01,AG,45344,1,A1,,6725451,"FLETCHER, RUSSELL B",Not Applicable,UNIVERSITY OF CALIFORNIA BERKELEY, ,2014,112297,
Neurophysiology of response inhibition in PD,NINDS,9033227,1K23NS091344-01A1,1,K23,NS,91344,1,A1,,9274812,"FLODEN, DARLENE ",Not Applicable,CLEVELAND CLINIC LERNER COM-CWRU, ,2015,168147,
Improving Metformin Utilization And Diabetes Control Through Patient-Centered Outcomes Research,AHRQ,8869461,1K08HS023898-01,1,K08,HS,23898,1,,,10081258,"FLORY, JAMES H",Not Applicable,WEILL MEDICAL COLL OF CORNELL UNIV, ,2015,152140,
Cardiovascular Safety of Combination Therapies for Type 2 Diabetes Mellitus,NHLBI,8580532,1K08HL116640-01A1,1,K08,HL,116640,1,A1,,10601094,"FLOYD, JAMES S",Not Applicable,UNIVERSITY OF WASHINGTON, ,2013,129789,
Sleep disturbance in spinal cord injury: Identifying symptoms and risk factors,NICHD,8699937,1K01HD076183-01A1,1,K01,HD,76183,1,A1,,11051576,"FOGELBERG, DONALD J.",Not Applicable,UNIVERSITY OF WASHINGTON, ,2014,117567,
Metabolic reprogramming in pluripotent induction and cardiac lineage specificatio,NHLBI,8791201,1K99HL121079-01A1,1,K99,HL,121079,1,A1,,11685151,"FOLMES, CLIFFORD D",Not Applicable,MAYO CLINIC ROCHESTER, ,2014,139428,
Development of mosaic mouse models of HCC for genetic interspecies inference,NCI,8805692,1K99CA191152-01,1,K99,CA,191152,1,,,10888946,"FONT-BURGADA, JOAN ",Not Applicable,"UNIVERSITY OF CALIFORNIA, SAN DIEGO", ,2015,109620,
The Johns Hopkins Clinical Research Scholars in Women's Health (BIRCWH),NICHD,8992103,1K12HD085845-01,1,K12,HD,85845,1,,,1881134,"FORD, DANIEL ERNEST",Not Applicable,JOHNS HOPKINS UNIVERSITY, ,2015,377999,
Institute for Clinical and Translational Research,NCATS,8721032,1KL2TR001077-01,1,KL2,TR,1077,1,,,1881134,"FORD, DANIEL ERNEST",Not Applicable,JOHNS HOPKINS UNIVERSITY, ,2013,1294527,
Obesity and Asthma Subphenotypes and Underlying Genetic and Genomic Pathways,NHLBI,8966069,1K08HL125666-01A1,1,K08,HL,125666,1,A1,,11524454,"FORNO, ERICK ",Not Applicable,UNIVERSITY OF PITTSBURGH AT PITTSBURGH, ,2015,126512,
Spatiotemporal investigations of parietal cortex contributions to episodic memory,NIMH,8678531,1K99MH103479-01,1,K99,MH,103479,1,,,11673015,"FOSTER, BRETT ",Not Applicable,STANFORD UNIVERSITY, ,2014,88976,
Neural Markers of Individual Difference in Emotion Regulation in Depressed Adults,NIMH,8503117,1K23MH097889-01A1,1,K23,MH,97889,1,A1,,9771070,"FOURNIER, JAY C",Not Applicable,UNIVERSITY OF PITTSBURGH AT PITTSBURGH, ,2013,154918,
Use of resting-state networks to predict the ideal site for brain stimulation,NINDS,8567020,1K23NS083741-01,1,K23,NS,83741,1,,,7231161,"FOX, MICHAEL D",Not Applicable,MASSACHUSETTS GENERAL HOSPITAL, ,2013,51540,
Effects of acculturation on gestational biology in Mexican-American pregnant women,NIDDK,8869681,1K01DK105110-01,1,K01,DK,105110,1,,,12291682,"FOX, MOLLY MAURER",Not Applicable,UNIVERSITY OF CALIFORNIA-IRVINE, ,2015,124675,
Cell Death and Cross-Protection in Rhinovirus Infection,NIAID,8949694,1K08AI119139-01,1,K08,AI,119139,1,,,11090235,"FOXMAN, ELLEN FLESCHER",Not Applicable,YALE UNIVERSITY, ,2015,179874,
Novel Role of Enterovirus 71 VP4 in Modulation of Cell Death Pathways,NIAID,8951514,1K08AI119434-01,1,K08,AI,119434,1,,,10878801,"FOY, EILEEN MARIE",Not Applicable,"UNIVERSITY OF CALIFORNIA, SAN FRANCISCO", ,2015,184054,
Developing an Outcome Measuring Unilateral Vocal Fold Paralysis Disability,NIDCD,8618574,1K23DC013559-01,1,K23,DC,13559,1,,,11127066,"FRANCIS, DAVID O.",Not Applicable,VANDERBILT UNIVERSITY, ,2014,197974,
Pilot Study to Improve Access to Early Intervention for Autism in Africa,NIMH,8959281,1K01MH104370-01A1,1,K01,MH,104370,1,A1,,11961364,"FRANZ, LAUREN ",Not Applicable,DUKE UNIVERSITY, ,2015,183599,
Genome-wide measurement of bacterial transcriptional regulatory states,NIGMS,8510026,1K99GM097033-01A1,1,K99,GM,97033,1,A1,,10291948,"FREDDOLINO, PETER L",Not Applicable,COLUMBIA UNIVERSITY HEALTH SCIENCES, ,2013,90000,
Specialized pro-resolving mediators in atherosclerosis,NHLBI,8566813,1K99HL119587-01,1,K99,HL,119587,1,,,10564907,"FREDMAN, GABRIELLE ",Not Applicable,COLUMBIA UNIVERSITY HEALTH SCIENCES, ,2013,108000,
Duke KURe Program,NIDDK,8588739,1K12DK100024-01,1,K12,DK,100024,1,,,8639259,"FREEDLAND, STEPHEN JAY",Not Applicable,DUKE UNIVERSITY, ,2013,474577,
Modeling Polycystic Kidney Disease Using Human Induced Pluripotent Stem Cells,NIDDK,8754901,1K01DK102826-01,1,K01,DK,102826,1,,,10307161,"FREEDMAN, BENJAMIN SOLOMON",Not Applicable,BRIGHAM AND WOMEN'S HOSPITAL, ,2014,157964,
Comparative effectiveness of catheter ablation vs medical therapy for atrial fibr,NHLBI,8487609,1K23HL118147-01,1,K23,HL,118147,1,,,10298405,"FREEMAN, JAMES ",Not Applicable,YALE UNIVERSITY, ,2013,159032,
Regulation of ChemR23 in Resolution of Inflammation,NIDCR,8568302,1K99DE023584-01,1,K99,DE,23584,1,,,11252997,"FREIRE, MARCELO ",Not Applicable,FORSYTH INSTITUTE, ,2013,103273,
Mentored Clinical Scientist Research Career Development Award,NICHD,8968030,1K08HD082287-01A1,1,K08,HD,82287,1,A1,,11708365,"FRIEDMAN, ALEXANDER M",Not Applicable,COLUMBIA UNIVERSITY HEALTH SCIENCES, ,2015,130682,
Microbial translocation; inflammation; and adverse pregnancy outcomes in humans,NIAID,8888207,1K24AI112964-01A1,1,K24,AI,112964,1,A1,,2047167,"FRIEDMAN, JENNIFER F",Not Applicable,RHODE ISLAND HOSPITAL, ,2015,159287,
Establishment and Application of a Library of Site-Specific Glycosylation Pattern,NIDDK,8679221,1K01DK101632-01,1,K01,DK,101632,1,,,11121170,"FROEHLICH, JOHN WILLIAM",Not Applicable,BOSTON CHILDREN'S HOSPITAL, ,2014,131693,
Mechanisms and Consequences of Heterochromatin Loss in Tauopathies,NINDS,8760586,1K99NS088429-01,1,K99,NS,88429,1,,,8443526,"FROST, BESS E",Not Applicable,BRIGHAM AND WOMEN'S HOSPITAL, ,2014,92880,
Pharmacology of Aminophylline for Acute Kidney Injury in Neonates and Children,NICHD,8678295,1K23HD079557-01,1,K23,HD,79557,1,,,10878865,"FRYMOYER, ADAM ",Not Applicable,STANFORD UNIVERSITY, ,2014,131895,
Causal inference of gene regulatory networks with application to breast cancer,NHGRI,8700855,1K99HG007368-01A1,1,K99,HG,7368,1,A1,,11260773,"FU, AUDREY QIUYAN",Not Applicable,UNIVERSITY OF CHICAGO, ,2014,87881,
Statistical methods for inferring recent human demographic and evolutionary history,NHGRI,8890381,1K99HG008122-01A1,1,K99,HG,8122,1,A1,,11697575,"FU, WENQING ",Not Applicable,UNIVERSITY OF WASHINGTON, ,2015,97429,
Mentoring and research in applying digital technologies to prevent chronic Illnesses,NINR,8949658,1K24NR015812-01,1,K24,NR,15812,1,,,7923842,"FUKUOKA, YOSHIMI ",Not Applicable,"UNIVERSITY OF CALIFORNIA, SAN FRANCISCO", ,2015,188616,
Translating discoveries in neurological diseases of infancy and childhood,NINDS,8785264,2K12NS001692-16,2,K12,NS,1692,16,,,2650789,"FULLERTON, HEATHER J",Not Applicable,"UNIVERSITY OF CALIFORNIA, SAN FRANCISCO", ,2014,177208,
SKELETAL MUSCLE DE NOVO LIPOGENESIS AND THE GLUCOSE-FATTY ACID CYCLE,NIDDK,8576894,1K01DK095774-01A1,1,K01,DK,95774,1,A1,,10432701,"FUNAI, KATSUHIKO ",Not Applicable,WASHINGTON UNIVERSITY, ,2013,6516,
Improving Older Adults' Decision Making For Obstructive Sleep Apnea Treatment,NIA,8591037,1K23AG045937-01,1,K23,AG,45937,1,,,11342143,"FUNG, CONSTANCE ",Not Applicable,UNIVERSITY OF CALIFORNIA LOS ANGELES, ,2013,159010,
The role of zinc transporters and dietary zinc in calcium oxalate urolithiasis,OD,8803863,1K01OD019912-01,1,K01,OD,19912,1,,,8176163,"FURROW, EVA ",Not Applicable,UNIVERSITY OF MINNESOTA, ,2015,129816,
Patient research in eosinophilic gastrointestinal diseases,NIDDK,8611685,1K24DK100303-01,1,K24,DK,100303,1,,,1868731,"FURUTA, GLENN T",Not Applicable,UNIVERSITY OF COLORADO DENVER, ,2013,175896,
Interferon Effector Gene Activation to Circumvent Viral Impedance,NIAID,8764488,1K08AI108629-01A1,1,K08,AI,108629,1,A1,,9708742,"FUSCO, DAHLENE NICOLE",Not Applicable,MASSACHUSETTS GENERAL HOSPITAL, ,2014,186192,
Delineation of a cytokine gene regulatory network and rewiring in disease,NIGMS,8867410,1K99GM114296-01,1,K99,GM,114296,1,,,10925612,"FUXMAN BASS, JUAN IGNACIO",Not Applicable,UNIV OF MASSACHUSETTS MED SCH WORCESTER, ,2015,90000,
Role of the circadian clock in melanocyte biology and UV-induced melanomagenesis,NIEHS,8488107,1K99ES022640-01,1,K99,ES,22640,1,,,10928862,"GADDAMEEDHI, SHOBHAN ",Not Applicable,UNIV OF NORTH CAROLINA CHAPEL HILL, ,2013,86400,
School-based air pollution and asthma morbidity in Inner City School Children,NIAID,8566468,1K23AI106945-01,1,K23,AI,106945,1,,,10552530,"GAFFIN, JONATHAN MARK",Not Applicable,BOSTON CHILDREN'S HOSPITAL, ,2013,182876,
Explaining Variation in Mortality after Pediatric Cardiac Surgery,NHLBI,8699996,1K08HL116639-01A1,1,K08,HL,116639,1,A1,,9313945,"GAIES, MICHAEL ",Not Applicable,UNIVERSITY OF MICHIGAN AT ANN ARBOR, ,2014,132300,
Genetics of Sessile Serrated Polyps,NIDDK,8767164,1K23DK103119-01,1,K23,DK,103119,1,,,10930232,"GALA, MANISH ",Not Applicable,MASSACHUSETTS GENERAL HOSPITAL, ,2014,186192,
Application of Cognitive; Emotional and Biological Dimensions  - Resubmission - 1,NIMH,8767056,1K01MH102415-01A1,1,K01,MH,102415,1,A1,,11587536,"GALATZER-LEVY, ISAAC R",Not Applicable,NEW YORK UNIVERSITY SCHOOL OF MEDICINE, ,2014,167317,
The anti-fibrotic effects of neuregulin in the heart,NHLBI,8616584,1K01HL121045-01,1,K01,HL,121045,1,,,10491453,"GALINDO, CRISTI LARA",Not Applicable,VANDERBILT UNIVERSITY, ,2014,130775,
NICOTINAMIDE MONONUCLEOTIDE ADENYLYLTRANSFERASES IN NEONATAL HYPOXIA-ISCHEMIA,NINDS,8567767,1K08NS083736-01,1,K08,NS,83736,1,,,11472321,"GALINDO, RAFAEL ",Not Applicable,WASHINGTON UNIVERSITY, ,2013,171339,
Cholesterol promotes breast cancer progression: establishing the mechanisms,NCI,8804581,1K08CA190770-01,1,K08,CA,190770,1,,,11672690,"GALLAGHER, EMILY JANE",Not Applicable,ICAHN SCHOOL OF MEDICINE AT MOUNT SINAI, ,2014,168571,
Epigenetic Changes in Bone Marrow Progenitor Cells Impair Diabetic Wound Healing,NIDDK,8567845,1K08DK102357-01,1,K08,DK,102357,1,,,11308185,"GALLAGHER, KATHERINE ANN",Not Applicable,UNIVERSITY OF MICHIGAN AT ANN ARBOR, ,2013,154904,
Phosphorus Absorption and Balance in Normal Physiology and Chronic Kidney Disease,NIDDK,8914299,1K01DK102864-01A1,1,K01,DK,102864,1,A1,,10667636,"GALLANT, KATHLEEN M HILL",Not Applicable,PURDUE UNIVERSITY, ,2015,139609,
MicroRNAs as Biomarkers in First-episode Schizophrenia,NIMH,8487628,1K23MH100264-01,1,K23,MH,100264,1,,,10442806,"GALLEGO, JUAN ANDRES",Not Applicable,FEINSTEIN INSTITUTE FOR MEDICAL RESEARCH, ,2013,181092,
The vessel wall as a paracrine engine in TGF beta-induced aortic aneurysm,NHLBI,8752550,1K99HL121287-01A1,1,K99,HL,121287,1,A1,,10543864,"GALLO MACFARLANE, ELENA ",Not Applicable,JOHNS HOPKINS UNIVERSITY, ,2014,113997,
D2 receptors in cholinergic interneurons: role in striatal circuitry & motivation,NIMH,8949276,1K01MH107648-01,1,K01,MH,107648,1,,,9766737,"GALLO, EDUARDO FRANCISCO",Not Applicable,NEW YORK STATE PSYCHIATRIC INSTITUTE, ,2015,186191,
Apoptotic Proteins as Molecular Modulators of Stem Cell Fate,NCI,8567221,1K99CA178190-01,1,K99,CA,178190,1,,,11517583,"GAMA, VIVIAN ",Not Applicable,UNIV OF NORTH CAROLINA CHAPEL HILL, ,2013,110956,
Mitochondrial Dysfunction in Chronic Kidney Disease,NIDDK,8617984,1K23DK100533-01,1,K23,DK,100533,1,,,9092972,"GAMBOA, JORGE LUIS",Not Applicable,VANDERBILT UNIVERSITY, ,2013,152230,
Mechanisms of monocytosis and accelerated atherosclerosis in patients with CKD,NIDDK,8581168,1K23DK097288-01A1,1,K23,DK,97288,1,A1,,9304741,"GANDA, ANJALI ",Not Applicable,COLUMBIA UNIVERSITY HEALTH SCIENCES, ,2013,181332,
Mentorship and Patient-Oriented Research in Tuberculosis; HIV and Global Health,NIAID,8790305,1K24AI114444-01,1,K24,AI,114444,1,,,9042737,"GANDHI, NEEL RAJNIKANT",Not Applicable,EMORY UNIVERSITY, ,2014,173842,
Development of circuit-based therapies for motor recovery after stroke,NINDS,8949311,1K02NS093014-01,1,K02,NS,93014,1,,,9478609,"GANGULY, KARUNESH ",Not Applicable,"UNIVERSITY OF CALIFORNIA, SAN FRANCISCO", ,2015,205729,
Traumatic Brain Injury and The Aging Brain: Predictors of Clinical Trajectories,NINDS,8965799,1K23NS095755-01,1,K23,NS,95755,1,,,11452426,"GARDNER, RAQUEL C.",Not Applicable,"UNIVERSITY OF CALIFORNIA, SAN FRANCISCO", ,2015,173880,
Michigan Vision Clinician Scientist Development Program,NEI,8469653,1K12EY022299-01A1,1,K12,EY,22299,1,A1,,1885241,"GARDNER, THOMAS W. ","LEE, PAUL P",UNIVERSITY OF MICHIGAN AT ANN ARBOR, ,2013,459121,
Mechanisms regulating thymus growth and involution,NIAID,8765570,1K08AI113216-01,1,K08,AI,113216,1,,,2607568,"GARFIN, PHILLIP M",Not Applicable,STANFORD UNIVERSITY, ,2014,160615,
Submucosal esophageal structures as a progenitor niche for esophageal repair,NIDDK,8485990,1K08DK098528-01,1,K08,DK,98528,1,,,10596122,"GARMAN, KATHERINE ",Not Applicable,DUKE UNIVERSITY, ,2013,113745,
An Integrative Bioinformatics Approach to Study Single Cancer Cell Heterogeneity,NIEHS,8830386,1K01ES025434-01,1,K01,ES,25434,1,,,10427600,"GARMIRE, LANA X",Not Applicable,UNIVERSITY OF HAWAII AT MANOA, ,2014,183608,
Brain Biomarkers of Clinical Response to Cognitive Treatment of PTSD in Youth,NIMH,8509195,1K01MH097769-01A1,1,K01,MH,97769,1,A1,,2094891,"GARRETT, AMY S",Not Applicable,STANFORD UNIVERSITY, ,2013,178541,
Improving Care Utilization and Outcomes in Transitioning Youth with Diabetes,NIDDK,8751484,1K23DK102655-01,1,K23,DK,102655,1,,,10166749,"GARVEY, KATHARINE ",Not Applicable,BOSTON CHILDREN'S HOSPITAL, ,2014,178855,
CRISPR/Cas9-Based Functional Characterization of ANK2 Mutations in ASD Neural Circuitry,NINDS,9014157,1K22NS094591-01,1,K22,NS,94591,1,,,9176698,"GARZA, JACOB C",Not Applicable,MASSACHUSETTS GENERAL HOSPITAL, ,2015,84431,
A Pathway-based Approach to Investigate Oncogenic Mechanisms in Ovarian Cancer,NCI,8442978,1K99CA166228-01A1,1,K99,CA,166228,1,A1,,8954110,"GATZA, MICHAEL L",Not Applicable,UNIV OF NORTH CAROLINA CHAPEL HILL, ,2013,99860,
Role of Myeloid Derived Suppressor Cells in the Immune Response to Surgery,NIGMS,8753053,1K23GM111657-01,1,K23,GM,111657,1,,,11816309,"GAUDILLIERE, BRICE ",Not Applicable,STANFORD UNIVERSITY, ,2014,130988,
Cortical mechanisms of learned spatial-temporal sequence coding,NIMH,8425728,1K99MH099654-01,1,K99,MH,99654,1,,,8837402,"GAVORNIK, JEFFREY PETER",Not Applicable,MASSACHUSETTS INSTITUTE OF TECHNOLOGY, ,2013,90000,
Functional Dissection of Autophagosome Biogenesis,NIGMS,8868838,1K99GM114397-01,1,K99,GM,114397,1,,,12212247,"GE, LIANG ",Not Applicable,UNIVERSITY OF CALIFORNIA BERKELEY, ,2015,86400,
The role of RHO GTPases and of coenzyme Q10 in nephrotic syndrome,NIDDK,8869180,1K99DK105335-01,1,K99,DK,105335,1,,,11708321,"GEE, HEON YUNG ",Not Applicable,BOSTON CHILDREN'S HOSPITAL, ,2015,91500,
Neural Mechanism of Obesity in Chronic Low Back Pain,NIDA,8679716,1K08DA037525-01,1,K08,DA,37525,1,,,8968298,"GEHA, PAUL ",Not Applicable,YALE UNIVERSITY, ,2014,182668,
Visualization of (Epi)Genomic Data for Discovery of Disease-Associated Variants,NHGRI,8633263,1K99HG007583-01A1,1,K99,HG,7583,1,A1,,10917418,"GEHLENBORG, NILS ",Not Applicable,HARVARD MEDICAL SCHOOL, ,2014,88642,
Sarm1 Pathway: New Therapeutic Targets in Neuropathy,NINDS,8868459,1K08NS091448-01,1,K08,NS,91448,1,,,12111921,"GEISLER, STEFANIE ",Not Applicable,WASHINGTON UNIVERSITY, ,2015,164449,
Psoriasis and the risk of diabetes,NIAMS,8486996,1K24AR064310-01,1,K24,AR,64310,1,,,6789416,"GELFAND, JOEL M",Not Applicable,UNIVERSITY OF PENNSYLVANIA, ,2013,162474,
Linkage to Care Following Home-Based Counseling and Testing in Western Kenya,NIMH,8603119,1K01MH099966-01A1,1,K01,MH,99966,1,A1,,9304154,"GENBERG, BECKY LYNN",Not Applicable,BROWN UNIVERSITY, ,2013,167030,
Identifying Transmission Routes for Cholera among Household Contacts of Cases ,NIAID,8820479,1K01AI110526-01A1,1,K01,AI,110526,1,A1,,10849861,"GEORGE, CHRISTINE MARIE",Not Applicable,JOHNS HOPKINS UNIVERSITY, ,2015,137713,
Hypertensive Mechanisms in Preeclampsia,NHLBI,8425342,1K99HL116774-01,1,K99,HL,116774,1,,,10456687,"GEORGE, ERIC MATTHEW",Not Applicable,UNIVERSITY OF MISSISSIPPI MED CTR, ,2013,69624,
Optimizing Stem Cell-Enhanced Stroke Recovery through a Bioengineered Electrically Conductive Polymer Scaffold,NINDS,9034324,1K08NS089976-01A1,1,K08,NS,89976,1,A1,,12085501,"GEORGE, PAUL ",Not Applicable,STANFORD UNIVERSITY, ,2015,187996,
Clinical decision support optimizing NEC prevention implementation in NICU,AHRQ,8819822,1K08HS022908-01A1,1,K08,HS,22908,1,A1,,10247556,"GEPHART, SHEILA MARIA",Not Applicable,UNIVERSITY OF ARIZONA, ,2014,134471,
A National Registry to Support Sarcoidosis Investigations,NHLBI,8581123,1K23HL114640-01A1,1,K23,HL,114640,1,A1,,9821636,"GERKE, ALICIA ",Not Applicable,UNIVERSITY OF IOWA, ,2013,127440,
Sleep and Circadian Dysregulation in Pediatric Bipolar Disorder,NIMH,8635600,1K01MH100433-01A1,1,K01,MH,100433,1,A1,,6717967,"GERSHON, ANDA ",Not Applicable,STANFORD UNIVERSITY, ,2014,180652,
Clinical Oncology Research Career Development Program (CORP),NCI,8486977,2K12CA076917-16,2,K12,CA,76917,16,,,6573086,"GERSON, STANTON L.",Not Applicable,CASE WESTERN RESERVE UNIVERSITY, ,2013,721474,
Evaluation of impact of anti-VEGF drugs on concomitant chemotherapy in GBM,NCI,8699478,1K23CA169021-01A1,1,K23,CA,169021,1,A1,,9577741,"GERSTNER, ELIZABETH ",Not Applicable,MASSACHUSETTS GENERAL HOSPITAL, ,2014,179280,
Organizational Dynamics and Failure to Rescue After Major Surgery,AHRQ,8967514,1K08HS023621-01A1,1,K08,HS,23621,1,A1,,11983938,"GHAFERI, AMIR ABBAS",Not Applicable,UNIVERSITY OF MICHIGAN AT ANN ARBOR, ,2015,155051,
Post-transcriptional Control of Gene Expression in Inflammatory Bowel Disease,NIDDK,9034162,1K08DK102957-01A1,1,K08,DK,102957,1,A1,,11042923,"GHANEM, LOUIS ",Not Applicable,CHILDREN'S HOSP OF PHILADELPHIA, ,2015,147667,
Bone Marrow Microenvironmental Expression of Cytochrome P450 Enzymes,NHLBI,8869404,1K08HL127269-01,1,K08,HL,127269,1,,,10718835,"GHIAUR, GABRIEL ",Not Applicable,JOHNS HOPKINS UNIVERSITY, ,2015,135945,
Connecting People; Places; and Barriers:  The Effect of These Connections on Adhe,NIDA,8730821,1K01DA037794-01,1,K01,DA,37794,1,,,11114055,"GHOSH, DEBARCHANA ",Not Applicable,UNIVERSITY OF CONNECTICUT STORRS, ,2014,172669,
Role of alternatively spliced Tissue Factor in atherosclerosis,NHLBI,8443278,1K23HL111339-01A1,1,K23,HL,111339,1,A1,,10770917,"GIANNARELLI, CHIARA ",Not Applicable,ICAHN SCHOOL OF MEDICINE AT MOUNT SINAI, ,2013,142340,
Comparative Effectiveness of Interventions for Depression in the Community,AHRQ,8487835,1K02HS022124-01,1,K02,HS,22124,1,,,8225620,"GIBBONS, MARY BETH ",Not Applicable,UNIVERSITY OF PENNSYLVANIA, ,2013,155100,
Cognitive Complaints in Aging Adults,NIA,8966527,1K23AG045966-01A1,1,K23,AG,45966,1,A1,,10941361,"GIFFORD, KATHERINE ANNE",Not Applicable,VANDERBILT UNIVERSITY, ,2015,67975,
Obesity associated inflammation and postmenopausal breast cancer.,NCI,8581246,1K99CA169430-01A1,1,K99,CA,169430,1,A1,,11085904,"GILES, ERIN ",Not Applicable,UNIVERSITY OF COLORADO DENVER, ,2013,109026,
The role of the hypoxic ECM on integrin-induced breast cancer metastasis,NCI,8617707,1K99CA181352-01,1,K99,CA,181352,1,,,10163230,"GILKES, DANIELE MARIE",Not Applicable,JOHNS HOPKINS UNIVERSITY, ,2014,90585,
Improving Healthcare Providers' Communication about HPV Vaccine,NCI,8750208,1K22CA186979-01,1,K22,CA,186979,1,,,11512394,"GILKEY, MELISSA B",Not Applicable,"HARVARD PILGRIM HEALTH CARE, INC.", ,2014,187368,
Chimeric Antigen Receptor T cell Therapy for Acute Myeloid Leukemia (AML),NCI,8869912,1K08CA194256-01,1,K08,CA,194256,1,,,10917511,"GILL, SAAR ",Not Applicable,UNIVERSITY OF PENNSYLVANIA, ,2015,167832,
Novel Neuromodulatory Intervention in the Rehabilitation of Pediatric Hemiparesis,NICHD,8820522,1K01HD078484-01A1,1,K01,HD,78484,1,A1,,10749085,"GILLICK, BERNADETTE THERESE",Not Applicable,UNIVERSITY OF MINNESOTA, ,2014,130821,
Neurobehavioral Characterization of Social Influence in Drug Addiction,NIDA,8508458,1K01DA034093-01A1,1,K01,DA,34093,1,A1,,10900074,"GILMAN, JODI ",Not Applicable,MASSACHUSETTS GENERAL HOSPITAL, ,2013,185218,
Integrating Biological Markers into Clinical Research,NIMH,8442480,1K24MH096760-01A1,1,K24,MH,96760,1,A1,,6624821,"GINSBURG, GOLDA SUSAN",Not Applicable,JOHNS HOPKINS UNIVERSITY, ,2013,164412,
Contributions of Glial Glutamate Transport and NMDA Receptors in Nicotine Relapse,NIDA,8618455,1K99DA036569-01,1,K99,DA,36569,1,,,9706320,"GIPSON-REICHARDT, CASSANDRA D",Not Applicable,MEDICAL UNIVERSITY OF SOUTH CAROLINA, ,2014,131054,
Neural circuit mechanisms of odor localization in mice,NIDCD,8564164,1K99DC013305-01,1,K99,DC,13305,1,,,8842712,"GIRE, DAVID HENRY",Not Applicable,HARVARD UNIVERSITY, ,2013,114890,
