Pain and Physical Decline Among Elderly Involved in Minor Traffic Accidents,NIA,8510193,1K23AG038548-01A1,1,K23,AG,38548,1,A1,,9797112,"PLATTS-MILLS, TIMOTHY FORTESCUE",Not Applicable,UNIV OF NORTH CAROLINA CHAPEL HILL, ,2013,158313,
Utility of Lung Ultrasound in Assessing Pulmonary Congestion in Heart Failure,NHLBI,8890473,1K23HL123533-01A1,1,K23,HL,123533,1,A1,,11917617,"PLATZ, ELKE ",Not Applicable,BRIGHAM AND WOMEN'S HOSPITAL, ,2015,152230,
Ahr2 activation and sox9b function in forebrain and cerebral vascular development,NIEHS,8791498,1K99ES023848-01A1,1,K99,ES,23848,1,A1,,6997106,"PLAVICKI, JESSICA SUSAN",Not Applicable,UNIVERSITY OF WISCONSIN-MADISON, ,2014,99101,
The role of excitatory inputs to BNST CRF neurons in alcohol drinking behavior,NIAAA,8805040,1K99AA023559-01,1,K99,AA,23559,1,,,10884190,"PLEIL, KRISTEN ELIZABETH",Not Applicable,UNIV OF NORTH CAROLINA CHAPEL HILL, ,2015,114169,
Beta 1 Integrin in the Lung,NHLBI,8867711,1K08HL127102-01,1,K08,HL,127102,1,,,10438082,"PLOSA, ERIN J",Not Applicable,VANDERBILT UNIVERSITY, ,2015,124924,
NMDA receptor trafficking by the autophagy regulatory protein beclin 1,NINDS,8767690,1K08NS085324-01A1,1,K08,NS,85324,1,A1,,6175196,"PLOWEY, EDWARD D",Not Applicable,STANFORD UNIVERSITY, ,2014,186559,
Mechanisms of Diabetic Susceptibility to Tuberculosis,OD,8766504,1K01OD016997-01A1,1,K01,OD,16997,1,A1,,10998226,"PODELL, BRENDAN ",Not Applicable,COLORADO STATE UNIVERSITY, ,2014,123093,
Observational data and treatment effectiveness: which methods work best?,NHLBI,8890985,1K25HL122305-01A1,1,K25,HL,122305,1,A1,,11054704,"POLGREEN, LINNEA ANN",Not Applicable,UNIVERSITY OF IOWA, ,2015,144563,
Adoptive T cell Therapy for Patients with NY-ESO-1 Expressing Sarcomas,NCI,8487145,1K23CA175167-01,1,K23,CA,175167,1,,,10327418,"POLLACK, SETH M",Not Applicable,FRED HUTCHINSON CANCER RESEARCH CENTER, ,2013,171720,
Regulation of VTA inhibitory synapses by acute and chronic stress,NIMH,8869205,1K99MH106757-01,1,K99,MH,106757,1,,,10926517,"POLTER, ABIGAIL MARIE",Not Applicable,BROWN UNIVERSITY, ,2015,75591,
PD2/Paf1 and pancreatic cancer stem cells,NCI,8635861,1K22CA175260-01A1,1,K22,CA,175260,1,A1,,10207340,"PONNUSAMY, MOORTHY P.",Not Applicable,UNIVERSITY OF NEBRASKA MEDICAL CENTER, ,2014,123278,
Anxiety in Parkinson's: Use of quantitative methods to guide rational treatment,NIA,8634954,1K23AG044441-01A1,1,K23,AG,44441,1,A1,,9418735,"PONTONE, GREGORY MICHAEL",Not Applicable,JOHNS HOPKINS UNIVERSITY, ,2014,204098,
Northwestern University Clinical and Translational Science Institute (NUCATS),NCATS,9085567,1KL2TR001424-01,1,KL2,TR,1424,1,,,1864074,"POPE, RICHARD M.",Not Applicable,NORTHWESTERN UNIVERSITY AT CHICAGO, ,2015,489980,
Communicating harm of new tobacco products,NCI,8754747,1K99CA187460-01,1,K99,CA,187460,1,,,11491230,"POPOVA, LYUDMILA ",Not Applicable,"UNIVERSITY OF CALIFORNIA, SAN FRANCISCO", ,2014,108907,
Living Alone in Older Age with Cognitive Impairment,NIA,8966995,1K01AG049102-01A1,1,K01,AG,49102,1,A1,,11550121,"PORTACOLONE, ELENA ",Not Applicable,"UNIVERSITY OF CALIFORNIA, SAN FRANCISCO", ,2015,144720,
Molecular mechanism of T cell evasion by Mycobacterium tuberculosis,NIAID,8948593,1K08AI119150-01,1,K08,AI,119150,1,,,11577692,"PORTAL CELHAY, CYNTHIA ",Not Applicable,NEW YORK UNIVERSITY SCHOOL OF MEDICINE, ,2015,185094,
The effect of endocrine disrupting chemicals on cardiac physiology,NIEHS,8618646,1K99ES023477-01,1,K99,ES,23477,1,,,9842149,"POSNACK, NIKKI GILLUM",Not Applicable,GEORGE WASHINGTON UNIVERSITY, ,2014,104963,
Functions of Heparan Sulfate Proteoglycans in Axon Guidance and Degeneration.,NINDS,8566033,1K99NS083714-01,1,K99,NS,83714,1,,,11311652,"POULAIN, FABIENNE EMMANUELLE",Not Applicable,UNIVERSITY OF UTAH, ,2013,88943,
MSK Paul Calabresi Career Development Award for Clinical Oncology,NCI,8875305,1K12CA184746-01A1,1,K12,CA,184746,1,A1,,1894143,"POWELL, SIMON N ","BRENTJENS, RENIER JOSEPH;SPRIGGS, DAVID R",SLOAN-KETTERING INST CAN RESEARCH, ,2015,54000,
Neighborhoods; daily stress; affect regulation; & Black male substance use,NIDA,8768110,1K01DA032611-01A1,1,K01,DA,32611,1,A1,,10129515,"POWELL, WIZDOM A",Not Applicable,UNIV OF NORTH CAROLINA CHAPEL HILL, ,2014,155294,
Stroke Plasticity,NINDS,8593893,1K23NS086852-01A1,1,K23,NS,86852,1,A1,,9632608,"PRABHAKARAN, VIVEK ",Not Applicable,UNIVERSITY OF WISCONSIN-MADISON, ,2014,190858,
Evaluating a non-contact fundus camera for retinopathy of prematurity screening,NEI,8675696,1K23EY024268-01,1,K23,EY,24268,1,,,11106888,"PRAKALAPAKORN, SASAPIN GRACE",Not Applicable,DUKE UNIVERSITY, ,2014,214314,
Role of Innate Immune Cells and Pathways in Ventilated Lung Ischemia Reperfusion,NIGMS,8679175,1K08GM110497-01,1,K08,GM,110497,1,,,11402659,"PRAKASH BUDDE, ARUN ",Not Applicable,"UNIVERSITY OF CALIFORNIA, SAN FRANCISCO", ,2015,197640,
Repair of Environmentally and Endogenously Induced Mitochondrial-DNA Damage,NIEHS,8762816,1K99ES024417-01,1,K99,ES,24417,1,,,10828874,"PRAKASH, AISHWARYA ",Not Applicable,UNIVERSITY OF VERMONT & ST AGRIC COLLEGE, ,2014,85743,
General pathways and personalized risk of morbidity after sepsis,NIGMS,8950589,1K08GM115859-01,1,K08,GM,115859,1,,,11787021,"PRESCOTT, HALLIE CHRISTINE",Not Applicable,UNIVERSITY OF MICHIGAN AT ANN ARBOR, ,2015,194254,
Video vs. TTG Respiratory inhaler technique Assessment and InstructioN (V-TRAIN),NHLBI,8488007,1K23HL118151-01,1,K23,HL,118151,1,,,9844494,"PRESS, VALERIE G",Not Applicable,UNIVERSITY OF CHICAGO, ,2013,155736,
Molecular Modulation of Actomyosin Mechanics by Cardiac Myosin-Binding Protein C,NHLBI,8762567,1K99HL124041-01,1,K99,HL,124041,1,,,10415922,"PREVIS, MICHAEL JOSEPH",Not Applicable,UNIVERSITY OF VERMONT & ST AGRIC COLLEGE, ,2014,143559,
Neural Dimensions of Attention Bias Modification for Transdiagnostic Anxiety,NIMH,8485272,1K23MH100259-01,1,K23,MH,100259,1,,,8816727,"PRICE, REBECCA ",Not Applicable,UNIVERSITY OF PITTSBURGH AT PITTSBURGH, ,2013,155011,
Use of Genetic Information by Life; Long-term Care; and Disability Insurers: Exploring International Lessons; the Domestic Legal Landscape; and Options for U.S. Policy,NHGRI,9013252,1K99HG008819-01,1,K99,HG,8819,1,,,11439840,"PRINCE, ANYA E.R.",Not Applicable,UNIV OF NORTH CAROLINA CHAPEL HILL, ,2015,91113,
Neuromodulation as a Treatment for Chemotherapy-Induced Peripheral Neuropathy,NCCAM,8767990,1K01AT008485-01,1,K01,AT,8485,1,,,9846834,"PRINSLOO, SARAH ",Not Applicable,UNIVERSITY OF TX MD ANDERSON CAN CTR, ,2014,128885,
Neurophysiological Basis of General Anesthesia,NIGMS,8488170,1K08GM106144-01,1,K08,GM,106144,1,,,10404450,"PROEKT, ALEXANDER ",Not Applicable,WEILL MEDICAL COLL OF CORNELL UNIV, ,2013,186609,
Using a Sequence-to-Structure-to-Function Approach to Functionally Characterize Protein Coding Missense Mutations in the Human and Rat Genomes,NIEHS,8828878,1K01ES025435-01,1,K01,ES,25435,1,,,12096701,"PROKOP, JEREMY WILLIAM",Not Applicable,MEDICAL COLLEGE OF WISCONSIN, ,2014,96423,
Prenatal Cigarette Exposure: The Role of Sleep and Parenting for Infant Outcomes,NIDA,8635418,1K01DA035298-01A1,1,K01,DA,35298,1,A1,,8380555,"PROPPER, CATHI BARBRA",Not Applicable,UNIV OF NORTH CAROLINA CHAPEL HILL, ,2014,161849,
A KLF15-PPARd Molecular Module Coordinates Skeletal Muscle Lipid Metabolism,NIDDK,9032927,1K01DK104922-01A1,1,K01,DK,104922,1,A1,,8294521,"PROSDOCIMO, DOMENICK A.",Not Applicable,CASE WESTERN RESERVE UNIVERSITY, ,2015,127941,
Stress & Parenting in Blacks: Preventing Obesity in Youth to Reduce Cancer Risk,NCI,8510284,1K01CA160818-01A1,1,K01,CA,160818,1,A1,,10662207,"PROUT PARKS, ELIZABETH ",Not Applicable,CHILDREN'S HOSP OF PHILADELPHIA, ,2013,130860,
MicroRNA 23 Cluster Regulation of Helper T cell Differentiation and Function,NIAID,8869922,1K08AI116949-01,1,K08,AI,116949,1,,,11646634,"PUA, HEATHER H",Not Applicable,"UNIVERSITY OF CALIFORNIA, SAN FRANCISCO", ,2015,164994,
Identifying a role for commensal bacteria on the liver immune priming environment,NIDDK,8566554,1K01DK099405-01,1,K01,DK,99405,1,,,9283940,"PUBLICOVER, JEAN ",Not Applicable,"UNIVERSITY OF CALIFORNIA, SAN FRANCISCO", ,2013,143014,
Mechanotransduction in the Ciliary Muscle,NEI,8487047,1K08EY023264-01,1,K08,EY,23264,1,,,10194333,"PUCKER, ANDREW D",Not Applicable,OHIO STATE UNIVERSITY, ,2013,137727,
Risk Factors for Sudden Cardiac Death in Patients with Chronic Kidney Disease,NIDDK,8699443,1K23DK098281-01A1,1,K23,DK,98281,1,A1,,6612424,"PUN, PATRICK H",Not Applicable,DUKE UNIVERSITY, ,2014,158665,
Neural correlates of Uncertainty Intolerance in Obsessive Compulsive Disorder,NIMH,8634396,1K01MH101326-01A1,1,K01,MH,101326,1,A1,,11008636,"PUSHKARSKAYA, HELEN ",Not Applicable,YALE UNIVERSITY, ,2014,182693,
Platelet activation in septic shock,NIGMS,8804343,1K23GM113041-01,1,K23,GM,113041,1,,,12098956,"PUSKARICH, MICHAEL A.",Not Applicable,UNIVERSITY OF MISSISSIPPI MED CTR, ,2015,189843,
The association of allergic disease with clinical outcomes in COPD.,NHLBI,8967303,1K23HL123594-01A1,1,K23,HL,123594,1,A1,,10594618,"PUTCHA, NIRUPAMA ",Not Applicable,JOHNS HOPKINS UNIVERSITY, ,2015,162943,
The Endocrine Complications of Cystic Fibrosis: the Role of CFTR,NIDDK,8890922,1K23DK102600-01A1,1,K23,DK,102600,1,A1,,10866422,"PUTMAN, MELISSA SUSAN",Not Applicable,BOSTON CHILDREN'S HOSPITAL, ,2015,152781,
Diabetes Self-Management Lifestyle Intervention for Urban Minority Young Adults,NIDDK,8766463,1K01DK099202-01A1,1,K01,DK,99202,1,A1,,10883726,"PYATAK, ELIZABETH F",Not Applicable,UNIVERSITY OF SOUTHERN CALIFORNIA, ,2014,152104,
HIV Infection; Metabolites and Subclinical Atherosclerosis,NHLBI,8993153,1K01HL129892-01,1,K01,HL,129892,1,,,10792184,"QI, QIBIN ",Not Applicable,ALBERT EINSTEIN COLLEGE OF MEDICINE, ,2015,34527,
Brown Remodeling of White Adipose Tissue by PPARgamma Deacetylation,NIDDK,8581242,1K99DK097455-01A1,1,K99,DK,97455,1,A1,,11286487,"QIANG, LI ",Not Applicable,COLUMBIA UNIVERSITY HEALTH SCIENCES, ,2013,90000,
Network-based Methods for Understanding Genetic Determinants and Epistasis in COPD,NHLBI,8950230,1K01HL129039-01,1,K01,HL,129039,1,,,11814088,"QIAO, DANDI ",Not Applicable,BRIGHAM AND WOMEN'S HOSPITAL, ,2015,140130,
Meiotic checkpoint pathways and gametocyte quality control,NICHD,8968204,1K99HD082375-01A1,1,K99,HD,82375,1,A1,,10800337,"QIAO, HUANYU ",Not Applicable,UNIVERSITY OF CALIFORNIA AT DAVIS, ,2015,89078,
MRI-based Quantitative Brain Perfusion Mapping for Sickle Cell Disease,NHLBI,8618677,1K25HL121192-01,1,K25,HL,121192,1,,,10950421,"QIN, QIN ",Not Applicable,HUGO W. MOSER RES INST KENNEDY KRIEGER, ,2014,152145,
Brain Systems Underlying Episodic Memory for Social Stimuli in Childhood Autism,NIMH,8805345,1K99MH105601-01,1,K99,MH,105601,1,,,12110206,"QIN, SHAOZHENG ",Not Applicable,STANFORD UNIVERSITY, ,2015,126252,
Generation of Cell-based and Animal-based Imaging Systems for Monitoring Synaptic,NIBIB,8764915,1K99EB017289-01A1,1,K99,EB,17289,1,A1,,10376901,"QIN, YAN ",Not Applicable,UNIVERSITY OF COLORADO, ,2014,89400,
Midcareer Investigator Award in Amylin; Cognition; and Alzheimer's Disease,NIA,8950488,1K24AG050842-01,1,K24,AG,50842,1,,,6070528,"QIU, WEI QIAO WENDY",Not Applicable,BOSTON UNIVERSITY MEDICAL CAMPUS, ,2015,169537,
Age and Group Differences in Language-Learning Biases,NIDCD,8821551,1K99DC013795-01A1,1,K99,DC,13795,1,A1,,10055146,"QUAM, CAROLYN MARIE",Not Applicable,UNIVERSITY OF ARIZONA, ,2014,94791,
Conceptualizing the problem of implementation: a systems engineering perspective applied in substance abuse treatment,NIDA,8869335,1K01DA039336-01,1,K01,DA,39336,1,,,9047077,"QUANBECK, ANDREW ",Not Applicable,UNIVERSITY OF WISCONSIN-MADISON, ,2015,154726,
Behavioral and Molecular Effects of Antenatal SSRI Exposure,NIMH,8425353,1K08MH099240-01,1,K08,MH,99240,1,,,6845107,"QUANG, LAWRENCE S",Not Applicable,CASE WESTERN RESERVE UNIVERSITY, ,2013,180360,
Differential mechanisms and consequences of Purkinje cell loss in an adult and pediatric model of global cerebral ischemia,NINDS,8967400,1K01NS086969-01A1,1,K01,NS,86969,1,A1,,8153816,"QUILLINAN, NIDIA ",Not Applicable,UNIVERSITY OF COLORADO DENVER, ,2015,223272,
Non-invasive label-free quantitative imaging for chronic wound characterization,NIBIB,8617944,1K99EB017723-01,1,K99,EB,17723,1,,,10745125,"QUINN, KYLE PATRICK",Not Applicable,TUFTS UNIVERSITY MEDFORD, ,2014,78012,
Pain and Health-Related Quality of Life in Children after Surgery,NICHD,8765636,1K23HD078239-01A1,1,K23,HD,78239,1,A1,,11242775,"RABBITTS, JENNIFER ",Not Applicable,SEATTLE CHILDREN'S HOSPITAL, ,2014,129692,
Cannabinoid control of fear extinction neural circuits in post-traumatic stress d,NIMH,8698598,1K01MH101123-01A1,1,K01,MH,101123,1,A1,,8911472,"RABINAK, CHRISTINE ANNE",Not Applicable,UNIVERSITY OF MICHIGAN AT ANN ARBOR, ,2014,39639,
Stanford Career Development Program in Omics of Lung Diseases,NHLBI,8575180,1K12HL120001-01,1,K12,HL,120001,1,,,2413447,"RABINOVITCH, MARLENE  ","NICOLLS, MARK ROBERT;SNYDER, MICHAEL P.",STANFORD UNIVERSITY, ,2013,124200,
Epidemiology and Biomarkers of Parkinsonism in Welders,NIEHS,8767827,2K24ES017765-06,2,K24,ES,17765,6,,,2056103,"RACETTE, BRAD A",Not Applicable,WASHINGTON UNIVERSITY, ,2014,167220,
Microdomain regulation of Ca2+ release in cardiac physiology and disease,NHLBI,8870061,1K99HL127299-01,1,K99,HL,127299,1,,,11288793,"RADWANSKI, PRZEMYSLAW ",Not Applicable,OHIO STATE UNIVERSITY, ,2015,93636,
Exergame Physical ActivityPainand Functional Mobility Among Women with Knee Ost,NIMHD,8079236,1K22MD006143-01,1,K22,MD,6143,1,,,10084460,"RAHIM-WILLIAMS, BRIDGETT ",Not Applicable,BETHUNE-COOKMAN COLLEGE, ,2015,242177,
Genetic and Molecular Insights Into Cartilage Regeneration; Primary and Posttraum,NIAMS,8700992,1K99AR064837-01A1,1,K99,AR,64837,1,A1,,10545921,"RAI, MUHAMMAD FAROOQ ",Not Applicable,WASHINGTON UNIVERSITY, ,2014,87675,
Noncanonical Receptor Signaling in Pulmonary Arterial Hypertension,NHLBI,8509407,1K08HL114643-01A1,1,K08,HL,114643,1,A1,,6096138,"RAJAGOPAL, SUDARSHAN K",Not Applicable,DUKE UNIVERSITY, ,2013,102584,
Systemic regulation of energy homeostasis using a Drosophila Leptin model,NIDDK,8791179,1K99DK101605-01A1,1,K99,DK,101605,1,A1,,10414706,"RAJAN, AKHILA ",Not Applicable,HARVARD MEDICAL SCHOOL, ,2014,89562,
'Biting' of human cells by Entamoeba histolytica:  a novel cytotoxic mechanism,NIAID,8618558,1K22AI108814-01,1,K22,AI,108814,1,,,9807986,"RALSTON, KATHERINE S",Not Applicable,UNIVERSITY OF CALIFORNIA AT DAVIS, ,2015,162000,
Role of taste signaling in airway epithelial function,NIDCD,8948771,1K23DC014747-01,1,K23,DC,14747,1,,,11697405,"RAMAKRISHNAN, VIJAY ",Not Applicable,UNIVERSITY OF COLORADO DENVER, ,2015,199800,
The Role Of p97-Chaperone Complexes In Protein Quality Control,NCI,8486954,1K22CA175142-01,1,K22,CA,175142,1,,,9549116,"RAMAN, MALAVIKA ",Not Applicable,TUFTS UNIVERSITY BOSTON, ,2015,180166,
Breast Cancer Prevention mHealth Intervention for Rural Latinas,NCI,8968108,1K01CA190659-01A1,1,K01,CA,190659,1,A1,,12004488,"RAMIREZ, A SUSANA",Not Applicable,"UNIVERSITY OF CALIFORNIA, MERCED", ,2015,126865,
Role of SCARF1 in Human Lupus,NIAMS,8762787,1K01AR066716-01,1,K01,AR,66716,1,,,11035647,"RAMIREZ-ORTIZ, ZAIDA GISELA",Not Applicable,MASSACHUSETTS GENERAL HOSPITAL, ,2014,132570,
Dysregulation of Neuronal Guidance Cue Netrin-1 in Accelerated AAA,NHLBI,8804126,1K99HL125667-01,1,K99,HL,125667,1,,,10890815,"RAMKHELAWON, BHAMA ",Not Applicable,NEW YORK UNIVERSITY SCHOOL OF MEDICINE, ,2015,110698,
ALK signaling in CNS development; ischemic brain injury and gliomagenesis,NINDS,8679269,1K08NS087118-01,1,K08,NS,87118,1,,,10774976,"RAMKISSOON, SHAKTI H",Not Applicable,BRIGHAM AND WOMEN'S HOSPITAL, ,2014,193590,
The role of natural selection in SLE risk among African-Americans,NIAMS,8805337,1K01AR067280-01,1,K01,AR,67280,1,,,9136141,"RAMOS, PAULA SOFIA",Not Applicable,MEDICAL UNIVERSITY OF SOUTH CAROLINA, ,2015,129087,
Genomic profiling and development of murine models of transformation of MPNs,NCI,8747728,1K08CA188529-01,1,K08,CA,188529,1,,,10605567,"RAMPAL, RAAJIT ",Not Applicable,SLOAN-KETTERING INST CAN RESEARCH, ,2014,178200,
Studies in HIV-1 Pathogenesis and Transmission,NICHD,8732335,1K24HD080539-01,1,K24,HD,80539,1,,,6593463,"RAMRATNAM, BHARAT ",Not Applicable,RHODE ISLAND HOSPITAL, ,2014,161487,
Improving Retention in Care Among Postpartum HIV-infected Women in Mississippi,NIMH,8659724,1K23MH100955-01A1,1,K23,MH,100955,1,A1,,8821355,"RANA, AADIA ",Not Applicable,MIRIAM HOSPITAL, ,2014,183568,
Text-Message-Based Depression Prevention for High-Risk Youth in the ED,NIMH,8510012,1K23MH095866-01A1,1,K23,MH,95866,1,A1,,10416298,"RANNEY, MEGAN LARIN",Not Applicable,RHODE ISLAND HOSPITAL, ,2013,182847,
Genetic and Epigenetic Determinants of Pediatric Obesity-Associated Asthma,NHLBI,8635532,1K23HL118733-01A1,1,K23,HL,118733,1,A1,,9772813,"RASTOGI, DEEPA ",Not Applicable,ALBERT EINSTEIN COLLEGE OF MEDICINE, ,2014,155520,
Integrating Adherence into a Safety Net EHR Tool to Improve Decision-making,AHRQ,8617713,1K08HS022561-01,1,K08,HS,22561,1,,,10343965,"RATANAWONGSA, NEDA ",Not Applicable,"UNIVERSITY OF CALIFORNIA, SAN FRANCISCO", ,2014,154290,
Enhancing Translational Science via Prospective Investigation,NCI,8581407,1K24CA172355-01A1,1,K24,CA,172355,1,A1,,2086862,"RATHMELL, W. KIMRYN",Not Applicable,UNIV OF NORTH CAROLINA CHAPEL HILL, ,2013,181385,
An evaluation of sensor technology to monitor and report compliance with an evidence-based intervention to prevent ventilator-associated pneumonia,NHLBI,8967301,1K23HL125982-01A1,1,K23,HL,125982,1,A1,,12095966,"RAWAT, NISHI ",Not Applicable,JOHNS HOPKINS UNIVERSITY, ,2015,159057,
EVALUATION OF AXONAL INTEGRITY USING DIFFUSION TENSOR IMAGING,NINDS,8616148,1K23NS084932-01,1,K23,NS,84932,1,,,11627624,"RAY, WILSON Z",Not Applicable,WASHINGTON UNIVERSITY, ,2013,171990,
Analyzing age-related changes of brain activation in subjects native space,NIA,8581477,1K01AG044467-01A1,1,K01,AG,44467,1,A1,,10438021,"RAZLIGHI, QOLAMREZA RAY",Not Applicable,COLUMBIA UNIVERSITY HEALTH SCIENCES, ,2013,126582,
Neutrophils as therapeutic targets in cryopyrin-associated periodic syndrome,NIAID,8791450,1K99AI110645-01A1,1,K99,AI,110645,1,A1,,10334129,"REBER, LAURENT LIONEL",Not Applicable,STANFORD UNIVERSITY, ,2014,129978,
Non-cardiomyocyte miR-34a Mediates Susceptibility to Right Heart Failure,NHLBI,8870024,1K08HL127277-01,1,K08,HL,127277,1,,,10799185,"REDDY, SUSHMA ",Not Applicable,STANFORD UNIVERSITY, ,2015,131652,
BCG therapy of bladder cancer: the role of BCG uptake by bladder cancer cells,NCI,8821836,1K08CA184038-01A1,1,K08,CA,184038,1,A1,,11776601,"REDELMAN-SIDI, GIL ",Not Applicable,SLOAN-KETTERING INST CAN RESEARCH, ,2014,178200,
ESTIMA: Economic and Social Empowerment To Increase Upwards Mobility among Women,NIMH,8790331,1K01MH099969-01A1,1,K01,MH,99969,1,A1,,8834190,"REED, ELIZABETH ANN",Not Applicable,"UNIVERSITY OF CALIFORNIA, SAN DIEGO", ,2014,188719,
Decreasing teen STI prevalence through universal emergency department screening,NICHD,8698873,1K23HD075751-01A1,1,K23,HD,75751,1,A1,,10779237,"REED, JENNIFER LYNN",Not Applicable,CINCINNATI CHILDRENS HOSP MED CTR, ,2014,131488,
Evolution of Quantitative MRI Biomarkers of Metabolic Syndrome During Puberty,NIDDK,8750986,1K24DK102595-01,1,K24,DK,102595,1,,,8546939,"REEDER, SCOTT B.",Not Applicable,UNIVERSITY OF WISCONSIN-MADISON, ,2014,185487,
Interrogating the Interaction between Toxoplasma Secreted Factors and the Host Im,NIAID,8224279,1K22AI097345-01,1,K22,AI,97345,1,,,10451939,"REESE, MICHAEL LLOYD",Not Applicable,UT SOUTHWESTERN MEDICAL CENTER, ,2014,162000,
'Enhanced Recovery' Protocols and the Cost and Quality of Inpatient Surgery,NIA,8821744,1K08AG047252-01A1,1,K08,AG,47252,1,A1,,11682570,"REGENBOGEN, SCOTT ELLIS",Not Applicable,UNIVERSITY OF MICHIGAN AT ANN ARBOR, ,2015,128160,
Life course contexts and work - quantifying impacts on aging and chronic disease,NIA,8680064,1K01AG047280-01,1,K01,AG,47280,1,,,9631969,"REHKOPF, DAVID H",Not Applicable,STANFORD UNIVERSITY, ,2014,126495,
The Role of ABO Glycosyltransferases in the Acute Respiratory Distress Syndrome,NHLBI,8966447,1K23HL125723-01A1,1,K23,HL,125723,1,A1,,11070890,"REILLY, JOHN PATRICK",Not Applicable,UNIVERSITY OF PENNSYLVANIA, ,2015,139320,
Il-6 and metabolic crosstalk between tissues,NIDDK,9032178,1K01DK105075-01A1,1,K01,DK,105075,1,A1,,10993615,"REILLY, SHANNON MARIE",Not Applicable,"UNIVERSITY OF CALIFORNIA, SAN DIEGO", ,2015,163608,
Abnormal STAT3 signaling and aberrant O-glycosylation of IgA1 in IgA nephropathy,NIDDK,8949844,1K01DK106341-01,1,K01,DK,106341,1,,,11587988,"REILY, COLIN ROBERT",Not Applicable,UNIVERSITY OF ALABAMA AT BIRMINGHAM, ,2015,154205,
The steroid receptor coactivator SRC-2 coordinates and modulates the metabolic; s,NHLBI,8485999,1K99HL118159-01,1,K99,HL,118159,1,,,10301276,"REINEKE, ERIN L",Not Applicable,BAYLOR COLLEGE OF MEDICINE, ,2013,109530,
Bioorthogonal Strategies for Targeted PET Imaging Probe Development,NIBIB,8487906,1K25EB016673-01,1,K25,EB,16673,1,,,10507928,"REINER, THOMAS ",Not Applicable,SLOAN-KETTERING INST CAN RESEARCH, ,2013,174906,
Mesenchymal Stromal Cells and Stromal Fibroblasts in Radiotherapy Resistance,NCI,8755329,1K99CA188093-01,1,K99,CA,188093,1,,,11671215,"REN, GUANGWEN ",Not Applicable,PRINCETON UNIVERSITY, ,2014,90000,
Gpr17 function in metabolism and satiety control,NIDDK,8766532,1K99DK098294-01A1,1,K99,DK,98294,1,A1,,11350722,"REN, HONGXIA ",Not Applicable,COLUMBIA UNIVERSITY HEALTH SCIENCES, ,2014,90000,
Developing a mobile emotion regulation intervention for HIV-positive men,NIDA,8846211,1K01DA039030-01,1,K01,DA,39030,1,,,10767419,"RENDINA, H JONATHON ",Not Applicable,HUNTER COLLEGE, ,2015,179766,
Lymphocyte trafficking blockade in allogeneic stem-cell transplantation,NCI,8568267,1K23CA178202-01,1,K23,CA,178202,1,,,10511799,"RESHEF, RAN ",Not Applicable,UNIVERSITY OF PENNSYLVANIA, ,2013,174744,
An Exercise Intervention to Prevent Interferon-Induced Depression in Hepatitis C,NIMH,8510319,1K01MH097847-01A1,1,K01,MH,97847,1,A1,,11053682,"RETHORST, CHAD D",Not Applicable,UT SOUTHWESTERN MEDICAL CENTER, ,2013,148640,
Improved Response Assessment in Anti-Angiogenic Treatment of Glioblastoma,NCI,8765939,1K25CA181632-01A1,1,K25,CA,181632,1,A1,,9804895,"REUTER, MARTIN ",Not Applicable,MASSACHUSETTS GENERAL HOSPITAL, ,2014,189837,
Identification of Gait and Imaging Markers for Freezing of Gait in Parkinson's Disease,NINDS,9033251,1K23NS091391-01A1,1,K23,NS,91391,1,A1,,10801822,"REVUELTA, GONZALO JAVIER",Not Applicable,MEDICAL UNIVERSITY OF SOUTH CAROLINA, ,2015,190877,
Critical roles of endogenous TLR signaling in driving Th17 effector responses,NIAID,8487096,1K22AI104941-01,1,K22,AI,104941,1,,,9766807,"REYNOLDS, JOSEPH MICHAEL",Not Applicable,ROSALIND FRANKLIN UNIV OF MEDICINE & SCI, ,2013,162000,
Afferent Hyperactivity Mechanisms in Overactive Bladder Syndrome,NIDDK,9034073,1K23DK103910-01A1,1,K23,DK,103910,1,A1,,10912891,"REYNOLDS, WILLIAM STUART",Not Applicable,VANDERBILT UNIVERSITY, ,2015,106378,
Airway Epithelial Barrier Dysfunction in Response to Respiratory Syncytial Virus,NIAID,8889770,1K08AI112781-01A1,1,K08,AI,112781,1,A1,,11080892,"REZAEE, FARIBA ",Not Applicable,UNIVERSITY OF ROCHESTER, ,2015,96347,
Neural Pathogenesis of Airway Smooth Muscle Defects in Airway Disease,NHLBI,8700090,1K99HL119560-01A1,1,K99,HL,119560,1,A1,,8508067,"REZNIKOV, LEAH R",Not Applicable,UNIVERSITY OF IOWA, ,2014,97200,
The Role of zbtb46 in Endothelial Cell Activation,NHLBI,8891847,1K08HL124292-01A1,1,K08,HL,124292,1,A1,,10548477,"REZVAN, AMIR ",Not Applicable,EMORY UNIVERSITY, ,2015,127035,
DIASTOLIC CLOSING MARGIN PREDICTS BRAIN INJURY IN PREMATURE INFANTS,NINDS,9032747,1K23NS091382-01A1,1,K23,NS,91382,1,A1,,11585882,"RHEE, CHRISTOPHER J.",Not Applicable,BAYLOR COLLEGE OF MEDICINE, ,2015,173732,
Hypothyroidism; Cardiovascular Health; and Survival in Kidney Disease,NIDDK,8764492,1K23DK102903-01,1,K23,DK,102903,1,,,10595774,"RHEE, CONNIE MEEYOUNG",Not Applicable,UNIVERSITY OF CALIFORNIA-IRVINE, ,2014,185827,
Gender Disparities and Vascular Function in Chronic Kidney Disease Outcomes,NIDDK,8441885,1K23DK094829-01A1,1,K23,DK,94829,1,A1,,10310294,"RICARDO, ANA CATHERINE",Not Applicable,UNIVERSITY OF ILLINOIS AT CHICAGO, ,2013,165648,
Multi-scale Orbitofrontal Networks Underlying Reward Processing,NIDA,8868828,1K08DA039351-01,1,K08,DA,39351,1,,,10923950,"RICH, ERIN L",Not Applicable,UNIVERSITY OF CALIFORNIA BERKELEY, ,2015,130529,
HIV and addictions among criminal justice-involved populations.,NIDA,8467116,2K24DA022112-06,2,K24,DA,22112,6,,,1888470,"RICH, JOSIAH D",Not Applicable,MIRIAM HOSPITAL, ,2013,174809,
Effect of hypertrophy mutation on kinetics of single cardiac myosin molecule,NHLBI,8768006,1K25HL124308-01,1,K25,HL,124308,1,,,11300545,"RICH, RYAN MICHAEL",Not Applicable,UNIVERSITY OF NORTH TEXAS HLTH SCI CTR, ,2014,91256,
Spinal Cord Injury Neuropathic Pain - Identifying Biopsychosocial Predictors,NICHD,8508026,1K23HD073680-01A1,1,K23,HD,73680,1,A1,,8469313,"RICHARDSON, ELIZABETH J",Not Applicable,UNIVERSITY OF ALABAMA AT BIRMINGHAM, ,2013,92837,
Cardiovascular protection by phytosterols in dyslipidemic mothers and progeny,NCCAM,8635422,1K01AT007826-01A1,1,K01,AT,7826,1,A1,,11344320,"RIDEOUT, TODD ",Not Applicable,STATE UNIVERSITY OF NEW YORK AT BUFFALO, ,2013,127161,
AACAP Physician Scientist Program in Substance Abuse,NIDA,8868577,2K12DA000357-16,2,K12,DA,357,16,,,1877513,"RIGGS, PAULA DEGRAFFENREID",Not Applicable,AMERICAN ACADEMY-CHILD/ADOLESCENT PSYCH, ,2015,1275966,
Mentoring patient-oriented research on the health consequences of polydrug use,NIDA,8990657,1K24DA039780-01A1,1,K24,DA,39780,1,A1,,1967706,"RILEY, ELISE D.",Not Applicable,"UNIVERSITY OF CALIFORNIA, SAN FRANCISCO", ,2015,185441,
